010.000.6117.01,INSULINA ASPARTA/INSULINA ASPARTA PROTAMINA. SUSPENSIÓN INYECTABLE Cada ml contiene: Insulina asparta de origen ADN recombinante (30% de insulina asparta soluble y 70% de insulina asparta protamina cristalina) 100 U. Envase o caja de cartón con 5 plumas prellenadas o precargadas con 3 mL (100 U/mL).
010.000.6160.00,Levonorgestrel. Polvo. El dispositivo intrauterino con polvo contiene: Levonorgestrel 19.5 mg Envase con un dispositivo intrauterino
010.000.6222.00,"ÁCIDO ACETILSALICÍLICO, TABLETAS Cada tableta contiene: Ácido acetilsalicílico 100 mg con o sin recubrimiento. Envase con 28 tabletas."
010.000.6279.00,AZITROMICINA. SUSPENSIÓN Cada 5 ml de suspensión contienen: Azitromicina 200 mg Frasco con polvo para reconstituir 10 ml.
010.000.6280.00,CLARITROMICINA. TABLETA Cada tableta contiene: Claritromicina 500 mg. Envase con 10 tabletas.
010.000.6281.00,AMOXICILINA / ÁCIDO CLAVULÁNICO. TABLETA Cada tableta contiene: Amoxicilina trihidratada equivalente a 875 mg de amoxicilina. Clavulanato de potasio equivalente a 125 mg de ácido clavulánico. Envase con 10 tabletas
010.000.6329.00,IVERMECTINA. TABLETA Cada tableta contiene 6 mg de ivermectina. Caja de cartón con 2 tabletas.
010.000.6330.00,BROMURO DE IPRATROPIO/FENOTEROL. AEROSOL. Cada mL contiene: Bromuro de ipratropio equivalente a:  0.394 mg. Fenoterol equivalente a:  0.938 mg. Envase con un frasco presurizado con dispositivo para inhalación 10 mL = 200 dosis.
010.000.6337.01,GLIMEPIRIDA. TABLETAS Cada tableta contiene Glimepirida 2 mg Envase con 30 tabletas
010.000.6343.00,CEFIXIMA. CÁPSULA Cada cápsula contiene: Cefixima trihidratada equivalente a cefixima 400 mg. Caja de cartón con 3 cápsulas.
010.000.6344.00,"CEFIXIMA. SUSPENSIÓN ORAL Cada 5 mL de suspensión contienen: Cefixima 100 mg Frasco con polvo para reconstituir 50 mL, con pipeta dosificadora."
010.000.7121.00,SITAGLIPTINA. TABLETA CADA TABLETA CONTIENE: CLORHIDRATO DE SITAGLIPTINAMONOHIDRATADA EQUIVALENTE A 50 MG DE SITAGLIPTINA. ENVASE CON 14 TABLETAS.
040.000.0302.00,Naloxona. Solución Inyectable Cada ampolleta contiene: Clorhidrato de naloxona 0.4 mg Envase con 10 ampolletas de 1 mL.
040.000.2106.00,Tramadol.  Solución Inyectable Cada ampolleta contiene: Clorhidrato de Tramadol 100 mg Envase con 5 ampolletas de 2 ml.
040.000.2608.00,Carbamazepina. Tableta. Cada Tableta contiene: Carbamazepina 200 mg Envase con 20 Tabletas.
040.000.2609.00,Carbamazepina. Suspensión Oral. Cada 5 ml contienen: Carbamazepina 100 mg Envase con 120 ml y dosificador de 5 ml.
040.000.3253.00,Haloperidol. Solución Inyectable Cada ampolleta contiene: Haloperidol 5 mg Envase con 6 ampolletas (5 mg/ml).
040.000.3258.00,Risperidona. Tableta Cada Tableta contiene: Risperidona 2 mg Envase con 40 Tabletas.
040.000.6141.01,Tramadol TABLETA DE LIBERACIÓN PROLONGADA Cada tableta de liberación prolongada contiene: Clorhidrato de Tramadol 200 mg Envase con 30 tabletas de liberación prolongada. 
